{
  "id": "SEC-AUTHZ-001",
  "title": "Object-level authorization",
  "version": "1.0",
  "evaluation_mode": "automated",
  "category": [
    "security",
    "authorization",
    "negative-testing"
  ],
  "task_file": "TASK.md",
  "workspace_dir": "repo",
  "protected_test_dir": "protected",
  "blocking_dimensions": [
    "FC",
    "SR",
    "EI"
  ],
  "controls": [
    "SEC-02",
    "SEC-07",
    "VER-02"
  ],
  "contamination_risk": "high",
  "created_at": "2026-09-09",
  "integrity_files": [
    "tests/test_documents.py"
  ],
  "notes": ""
}
