{
  "id": "SEC-PATH-001",
  "title": "Path traversal resistance",
  "version": "1.0",
  "evaluation_mode": "automated",
  "category": [
    "security",
    "filesystem",
    "path-traversal"
  ],
  "task_file": "TASK.md",
  "workspace_dir": "repo",
  "protected_test_dir": "protected",
  "blocking_dimensions": [
    "FC",
    "SR",
    "EI"
  ],
  "controls": [
    "SEC-03",
    "SEC-04",
    "SEC-07"
  ],
  "contamination_risk": "high",
  "created_at": "2026-09-09",
  "integrity_files": [
    "tests/test_storage.py"
  ],
  "notes": ""
}
