{
  "id": "REL-IDEMP-001",
  "title": "Idempotent payment retry",
  "version": "1.0",
  "evaluation_mode": "automated",
  "category": [
    "reliability",
    "idempotency",
    "financial-integrity"
  ],
  "task_file": "TASK.md",
  "workspace_dir": "repo",
  "protected_test_dir": "protected",
  "blocking_dimensions": [
    "FC",
    "SR",
    "EI"
  ],
  "controls": [
    "REL-02",
    "DAT-02",
    "ARC-04"
  ],
  "contamination_risk": "high",
  "created_at": "2026-09-09",
  "integrity_files": [
    "tests/test_payments.py"
  ],
  "notes": ""
}
