{
  "id": "DAT-ATOMIC-001",
  "title": "Atomic transfer on failure",
  "version": "1.0",
  "evaluation_mode": "automated",
  "category": [
    "data-integrity",
    "transactionality",
    "exception-safety"
  ],
  "task_file": "TASK.md",
  "workspace_dir": "repo",
  "protected_test_dir": "protected",
  "blocking_dimensions": [
    "FC",
    "SR",
    "EI"
  ],
  "controls": [
    "DAT-02",
    "SEC-06",
    "ARC-04"
  ],
  "contamination_risk": "high",
  "created_at": "2026-09-09",
  "integrity_files": [
    "tests/test_ledger.py"
  ],
  "notes": ""
}
