{
  "id": "REL-CACHE-001",
  "title": "Bounded cache under sustained use",
  "version": "1.0",
  "evaluation_mode": "automated",
  "category": [
    "reliability",
    "resource-bounds",
    "software-aging"
  ],
  "task_file": "TASK.md",
  "workspace_dir": "repo",
  "protected_test_dir": "protected",
  "blocking_dimensions": [
    "FC",
    "SR",
    "EI"
  ],
  "controls": [
    "REL-05",
    "REL-04",
    "ARC-06"
  ],
  "contamination_risk": "high",
  "created_at": "2026-09-09",
  "integrity_files": [
    "tests/test_cache.py"
  ],
  "notes": ""
}
